<?xml version="1.0" encoding="UTF-8"?>
<?xml-stylesheet href="./style.xsl" type="text/xsl"?>
<racine xsi:noNamespaceSchemaLocation="./fsML.xsd" xmlns:xsi="http://www.w3.org/2001/XMLSchema-instance">
    <dossier id="D1" nom="pics" creation="2018">
        <dossier id="D6" nom="Mql" creation="2018"></dossier>
        <dossier id="D2" nom="Wisd" creation="2018"></dossier>
        <fichier id="F1" nom="Midvi" creation="2000" dateModification="2010" taille="30"></fichier>

    </dossier>
    <dossier id="D3" nom="pics" creation="2018">
        <dossier id="D4" nom="otherMql" creation="2021"></dossier>
        <fichier id="F2" nom="otherWisd" creation="2000" dateModification="2010" taille="30"></fichier>
    </dossier>
    <fichier id="F3" nom="pics" creation="2020" dateModification="2018" taille="20"></fichier>
    <profile id="E2">blahblah</profile>
</racine> 
